{
  "$schema": "https://json-schema.org/draft/2020-12/schema",
  "title": "per-meeting-job",
  "description": "One unit of summarization work: the fan-out (m3) emits exactly one per meeting key; the per-meeting agent (m4) consumes it.",
  "type": "object",
  "properties": {
    "meeting-key": { "$ref": "meeting-key-and-source-set.schema.json#/$defs/meeting-key" },
    "source-set": { "$ref": "meeting-key-and-source-set.schema.json#/$defs/source-set" },
    "disposition": {
      "enum": ["new", "already-done", "amend"],
      "description": "new: no summary exists yet; already-done: fully processed, nothing to do; amend: a summary exists and must be rewritten in place"
    },
    "amend": {
      "type": "object",
      "description": "present exactly when disposition is amend",
      "properties": {
        "summary": {
          "$ref": "destination-repo-set.schema.json#/$defs/repo-file-ref",
          "description": "the existing summary file to rewrite in place — never a second file"
        },
        "coverage": {
          "type": "array",
          "minItems": 1,
          "uniqueItems": true,
          "items": { "$ref": "transcript-record.schema.json#/$defs/source" },
          "description": "the sources the existing summary was built from"
        }
      },
      "required": ["summary", "coverage"],
      "additionalProperties": false
    }
  },
  "required": ["meeting-key", "source-set", "disposition"],
  "additionalProperties": false,
  "if": {
    "properties": { "disposition": { "const": "amend" } },
    "required": ["disposition"]
  },
  "then": { "required": ["amend"] }
}
